[
  {
    "id": "79:27", "surah": 79, "ayah": 27, "place": "makkah",
    "title": "Are you harder to create, or the sky?",
    "subtitle": "One question that answers the doubt",
    "picture": {"kind": "boxes", "label": "The comparison", "row": [
      {"box": "people", "title": "you", "sub": ["one small body"]},
      {"conn": "or"},
      {"box": "idea", "title": "the heaven", "sub": ["vast, built by Allah"]}]},
    "key": {"label": "Which is harder", "row": [
      {"box": "trap", "title": "raising me", "sub": ["too hard"], "strike": true},
      {"box": "idea", "title": "the sky", "sub": ["harder, and already done"]}]},
    "then": "After the story, the surah returns to the deniers' doubt about being brought back. Ibn Kathir says the answer is plain: {idea}the heaven is more difficult to create than you.{/idea} He links it to verses saying the heavens and earth are greater than the creation of people.",
    "now": "You worry whether you can be forgiven, or whether things can be fixed. Then you look up at the night sky over the parking lot. {idea}The One who built that is not stretched by you.{/idea}",
    "old": "My situation is too complicated even for Allah.",
    "new": "If He built the sky, nothing about me is hard for Him.",
    "try": "Look at the sky once today and say: You made this, You can mend me.",
    "related": ["40:57", "36:81"],
    "meta": {"version": 1, "status": "draft", "reviewer": null, "updated": "2026-10-19"}
  },
  {
    "id": "79:28", "surah": 79, "ayah": 28, "place": "makkah",
    "title": "He raised its ceiling high and made it even.",
    "subtitle": "Precision in the sky",
    "picture": {"kind": "boxes", "label": "How it was built", "row": [
      {"box": "idea", "title": "raised high", "sub": ["a lofty structure"]},
      {"box": "idea", "title": "proportioned", "sub": ["equal sides, adorned with stars"]}]},
    "key": {"label": "What the sky is", "row": [
      {"box": "plain", "title": "empty space", "sub": [], "strike": true},
      {"box": "idea", "title": "a building", "sub": ["with a Builder"]}]},
    "then": "Ibn Kathir explains that Allah {idea}made it a lofty structure, vast in its space, with equal sides,{/idea} adorned with stars at night. The listeners in Makkah saw that sky every night without a single light to block it.",
    "now": "An architect friend shows you a building and talks about load, balance, proportion. You leave impressed. {idea}The ceiling over every city on earth was proportioned by Allah.{/idea}",
    "old": "The sky is just there, nothing to think about.",
    "new": "The sky is raised and balanced, a building that points to its Builder.",
    "try": "Look up at night this week and find one star. Say SubhanAllah.",
    "related": [],
    "meta": {"version": 1, "status": "draft", "reviewer": null, "updated": "2026-10-19"}
  },
  {
    "id": "79:29", "surah": 79, "ayah": 29, "place": "makkah",
    "title": "He darkened its night and brought out its morning.",
    "subtitle": "Night and day, both from Him",
    "picture": {"kind": "boxes", "label": "The cycle", "row": [
      {"box": "people", "title": "night", "sub": ["made dark"]},
      {"conn": "then"},
      {"box": "reward", "title": "forenoon", "sub": ["bright, shining, clear"]}]},
    "key": {"label": "Who brings the morning", "row": [
      {"box": "plain", "title": "it just comes", "sub": [], "strike": true},
      {"box": "idea", "title": "He brings it out", "sub": ["every single day"]}]},
    "then": "Ibn Kathir says Allah {idea}made its night dark and extremely black, and its day bright, luminous and clear.{/idea} Ibn Abbas, Mujahid, Ikrimah and others explained the word as making it dark.",
    "now": "A long, bad night: a sick child, a worry that will not stop. Then the window turns grey, then light. {reward}The morning was brought out for you{/reward}, like it is every day.",
    "old": "Dark times last forever.",
    "new": "The One who darkens the night is the One who brings out the morning.",
    "try": "Tomorrow, catch the first light of morning and thank Allah for it.",
    "related": [],
    "meta": {"version": 1, "status": "draft", "reviewer": null, "updated": "2026-10-19"}
  },
  {
    "id": "79:30", "surah": 79, "ayah": 30, "place": "makkah",
    "title": "After that, He spread out the earth.",
    "subtitle": "The ground made ready for life",
    "picture": {"kind": "boxes", "label": "The order", "row": [
      {"box": "idea", "title": "the heaven", "sub": ["built"]},
      {"conn": "after that"},
      {"box": "idea", "title": "the earth", "sub": ["spread out"]}]},
    "key": {"label": "What spreading means", "row": [
      {"box": "plain", "title": "just flattened", "sub": [], "strike": true},
      {"box": "reward", "title": "opened up", "sub": ["its hidden benefits brought out"]}]},
    "then": "Ibn Kathir notes that the earth was created before the heaven, but {idea}spread out after the heaven was created.{/idea} Spreading it means He brought out what was inside it. This was said by Ibn Abbas and preferred by Ibn Jarir.",
    "now": "You unroll a picnic blanket and lay out the food. Everything ready before anyone sits. {reward}The earth was spread and stocked before you arrived{/reward}.",
    "old": "The earth is just where I happen to live.",
    "new": "It was spread out and prepared, which means I was expected.",
    "try": "Walk outside barefoot for a minute, if you can, and thank Allah for the ground.",
    "related": [],
    "meta": {"version": 1, "status": "draft", "reviewer": null, "updated": "2026-10-19"}
  },
  {
    "id": "79:31", "surah": 79, "ayah": 31, "place": "makkah",
    "title": "He brought out its water and its pasture.",
    "subtitle": "What came out of the ground",
    "picture": {"kind": "boxes", "label": "From the earth", "row": [
      {"box": "reward", "title": "water", "sub": ["springs and rivers"]},
      {"box": "reward", "title": "pasture", "sub": ["plants and grazing"]}]},
    "key": {"label": "Where water comes from", "row": [
      {"box": "plain", "title": "the tap", "sub": [], "strike": true},
      {"box": "idea", "title": "brought out by Him", "sub": ["from inside the earth"]}]},
    "then": "Ibn Kathir explains this as what spreading the earth means: {reward}He caused its springs to gush and brought forth its hidden benefits.{/reward} For people of the desert, a spring or green pasture meant survival.",
    "now": "You turn on the tap and water just comes. You never think of the wells, the rivers, the rain far away. {idea}Every glass is water He brought out of the earth.{/idea}",
    "old": "Water and food are just there, provided by the system.",
    "new": "Allah brought them out of the earth for me.",
    "try": "Use a little less water today, and thank Allah for every drop.",
    "related": [],
    "meta": {"version": 1, "status": "draft", "reviewer": null, "updated": "2026-10-19"}
  },
  {
    "id": "79:32", "surah": 79, "ayah": 32, "place": "makkah",
    "title": "And He set the mountains firm.",
    "subtitle": "Anchored in their places",
    "picture": {"kind": "boxes", "label": "The mountains", "row": [
      {"box": "idea", "title": "settled", "sub": []},
      {"box": "idea", "title": "made firm", "sub": []},
      {"box": "idea", "title": "fixed in place", "sub": []}]},
    "key": {"label": "Who holds them", "row": [
      {"box": "plain", "title": "they hold themselves", "sub": [], "strike": true},
      {"box": "reward", "title": "the Most Wise", "sub": ["kind to His creation"]}]},
    "then": "Ibn Kathir says Allah {idea}settled them, made them firm, and established them in their places.{/idea} He adds that Allah is the Most Wise, the All-Knowing, {reward}Most Kind to His creation, Most Merciful.{/reward}",
    "now": "When your life shakes, a lost job, a hard diagnosis, you look for something steady. {reward}The One who fixed the mountains firm is the One you can lean on.{/reward}",
    "old": "Nothing in my life feels stable.",
    "new": "The One who anchored the mountains can anchor my heart.",
    "try": "When something shakes you today, say Hasbunallahu wa nimal wakil.",
    "related": [],
    "meta": {"version": 1, "status": "draft", "reviewer": null, "updated": "2026-10-19"}
  },
  {
    "id": "79:33", "surah": 79, "ayah": 33, "place": "makkah",
    "title": "All of it as provision for you and your animals.",
    "subtitle": "Who the earth was prepared for",
    "picture": {"kind": "boxes", "label": "What it was all for", "row": [
      {"box": "idea", "title": "sky, earth, water, mountains", "sub": ["verses 27-32"]},
      {"conn": "for"},
      {"box": "people", "title": "you", "sub": []},
      {"box": "people", "title": "your livestock", "sub": []}]},
    "key": {"label": "What the gift asks", "row": [
      {"box": "trap", "title": "use it and forget", "sub": [], "strike": true},
      {"box": "idea", "title": "use it and remember", "sub": ["the Giver will ask"]}]},
    "then": "Ibn Kathir says all this was done {reward}as provision and benefit for you and your cattle.{/reward} For a people who lived by their herds, the point was clear. The next verse turns straight to the Great Catastrophe.",
    "now": "Your groceries, your pet's food, the milk in the fridge. All of it traces back to this verse. {idea}A gift this large is not given without a question later{/idea}: what did you do with it?",
    "old": "I paid for my food, so it is mine.",
    "new": "It is provision prepared for me by Allah, and I will be asked about it.",
    "try": "Share one meal or some food with someone today.",
    "related": [],
    "meta": {"version": 1, "status": "draft", "reviewer": null, "updated": "2026-10-19"}
  }
]
