[
  {
    "id": "109:1", "surah": 109, "ayah": 1, "place": "makkah",
    "title": "Say it plainly: some things are not up for trade.",
    "subtitle": "The answer to a compromise offer",
    "picture": {"kind": "boxes", "label": "The offer", "row": [
      {"box": "people", "title": "Quraysh chiefs", "sub": ["tired of the dispute"]},
      {"conn": "proposed"},
      {"box": "trap", "title": "a year each", "sub": ["our gods, then your God"]},
      {"conn": "answered by"},
      {"box": "idea", "title": "Say", "sub": ["a surah of disavowal"]}]},
    "key": {"label": "What a deal looks like", "row": [
      {"box": "trap", "title": "meet halfway", "sub": ["on worship itself"], "strike": true},
      {"box": "idea", "title": "a clear line", "sub": ["worship is not negotiable"]}]},
    "then": "The Quraysh chiefs, Maududi says, still hoped for a compromise. Ibn Kathir reports {trap}they invited the Prophet ﷺ to worship their idols for a year, and they would worship his God for a year{/trap}. Allah answered with this surah, which the Prophet ﷺ often recited {reward}in the two rakahs before Fajr{/reward}.",
    "now": "Your manager suggests cutting a corner just this once. Friends push you to skip prayer for the trip. Not a fight, just a nice offer to meet in the middle. {idea}This surah teaches you how to say no calmly{/idea}, without anger and without wobbling.",
    "old": "Keeping the peace means meeting everyone halfway on everything.",
    "new": "I can be kind and still hold a line on what I worship and obey.",
    "try": "Recite this surah in your next sunnah prayer before Fajr or after Maghrib.",
    "related": ["112:1"],
    "meta": {"version": 1, "status": "draft", "reviewer": null, "updated": "2026-10-19"}
  },
  {
    "id": "109:2", "surah": 109, "ayah": 2, "place": "makkah",
    "title": "I do not worship what you worship. Not now.",
    "subtitle": "A clear statement about the present",
    "picture": {"kind": "boxes", "label": "What is refused", "row": [
      {"box": "people", "title": "I", "sub": ["the Messenger ﷺ"]},
      {"conn": "do not worship"},
      {"box": "trap", "title": "statues and rivals", "sub": ["what they worshipped"]}]},
    "key": {"label": "My hidden idols", "row": [
      {"box": "plain", "title": "idols are only statues", "sub": ["not my problem"], "strike": true},
      {"box": "trap", "title": "anything I obey over Allah", "sub": ["money, approval, ego"]}]},
    "then": "Ibn Kathir says this means {trap}statues and rival gods{/trap}. Allah commanded His Messenger ﷺ {idea}to disavow their religion completely{/idea}. The first line is about right now: I do not.",
    "now": "You may never bow to a statue. But the phone you check before you pray, the boss whose approval decides your mood, the follower count you refresh. {idea}What gets your first attention is close to what you serve.{/idea} Say this verse to those too.",
    "old": "I would never worship anything except Allah.",
    "new": "Worship includes what I obey and put first. I say no to every rival, not just statues.",
    "try": "Notice the first thing you reach for when you wake tomorrow. Let it be Allah's name.",
    "related": [],
    "meta": {"version": 1, "status": "draft", "reviewer": null, "updated": "2026-10-19"}
  },
  {
    "id": "109:3", "surah": 109, "ayah": 3, "place": "makkah",
    "title": "And you are not worshipping the One I worship.",
    "subtitle": "Two objects of worship, not the same",
    "picture": {"kind": "boxes", "label": "Whom I worship", "row": [
      {"box": "idea", "title": "Allah alone", "sub": ["Who has no partner"]},
      {"conn": "not"},
      {"box": "trap", "title": "Allah plus others", "sub": ["shared worship"]}]},
    "key": {"label": "Is it the same?", "row": [
      {"box": "plain", "title": "it all goes to God", "sub": ["just labels"], "strike": true},
      {"box": "idea", "title": "Allah with no partner", "sub": ["is a different worship"]}]},
    "then": "Ibn Kathir says the One worshipped is {idea}Allah alone, Who has no partner{/idea}. He notes that the word ma (what) here means man (who). The Quraysh worshipped Allah {trap}alongside partners{/trap}, and that is not the same worship.",
    "now": "You pray to Allah, and then quietly add others: a lucky charm in the car, a feeling that your success depends on a person. {idea}Worship mixed with partners is not the worship Allah asks for.{/idea} Look for anything you have quietly added.",
    "old": "As long as I believe in Allah, a few extra habits do not matter.",
    "new": "Allah is worshipped alone. Anything I add beside Him changes the worship.",
    "try": "Remove one object or habit you rely on for luck or protection besides Allah.",
    "related": [],
    "meta": {"version": 1, "status": "draft", "reviewer": null, "updated": "2026-10-19"}
  },
  {
    "id": "109:4", "surah": 109, "ayah": 4, "place": "makkah",
    "title": "Nor will I ever worship the way you worship.",
    "subtitle": "Not only whom, but how",
    "picture": {"kind": "boxes", "label": "The way of worship", "row": [
      {"box": "trap", "title": "your way", "sub": ["I will not follow it"]},
      {"conn": "instead"},
      {"box": "idea", "title": "as Allah loves", "sub": ["the way He is pleased with"]}]},
    "key": {"label": "Whose method", "row": [
      {"box": "plain", "title": "whatever feels right", "sub": ["my own style"], "strike": true},
      {"box": "idea", "title": "what He legislated", "sub": ["the Messenger's ﷺ way"]}]},
    "then": "Ibn Kathir explains this repetition differently: {idea}I do not worship according to your worship{/idea}, I do not go along with it. {reward}I only worship Allah in the manner He loves and is pleased with.{/reward}",
    "now": "There is a trend for everything, even spirituality: a custom ritual from a video, a habit invented by a group chat. {idea}This verse is about method.{/idea} You do not get to invent the way to Allah. He has already shown it through His Messenger ﷺ.",
    "old": "How I worship is up to me, as long as my intention is good.",
    "new": "Allah chose the way He is worshipped. Following it is part of sincerity.",
    "try": "Learn one sunnah of the Prophet ﷺ in prayer that you did not know before, and do it today.",
    "related": [],
    "meta": {"version": 1, "status": "draft", "reviewer": null, "updated": "2026-10-19"}
  },
  {
    "id": "109:5", "surah": 109, "ayah": 5, "place": "makkah",
    "title": "Nor will you worship what I worship, by desire.",
    "subtitle": "Worship invented from the self",
    "picture": {"kind": "boxes", "label": "Two sources", "row": [
      {"box": "idea", "title": "Allah's guidance", "sub": ["what He commanded"]},
      {"conn": "versus"},
      {"box": "trap", "title": "the soul's promptings", "sub": ["guess and desire"]}]},
    "key": {"label": "Where my religion comes from", "row": [
      {"box": "trap", "title": "what I want it to be", "sub": ["shaped by my desires"], "strike": true},
      {"box": "idea", "title": "what Allah sent", "sub": ["guidance from my Lord"]}]},
    "then": "Ibn Kathir says this second time means {trap}you do not follow Allah's commands; you have invented something out of the promptings of your own souls{/trap}. He cites: {idea}they follow a guess and what they desire, while guidance has come from their Lord{/idea}.",
    "now": "It is easy to keep the parts of religion that suit you and quietly drop the rest. The modest dress, the honest tax return, the patience with your parents. {trap}Picking by preference is the trap this verse names{/trap}. Turn it on yourself first.",
    "old": "I follow the parts of the religion that make sense to me.",
    "new": "When my desires edit my religion, I start worshipping my wants. I follow what Allah sent.",
    "try": "Pick one teaching you have been avoiding because it is inconvenient. Take one small step toward it.",
    "related": ["53:23"],
    "meta": {"version": 1, "status": "draft", "reviewer": null, "updated": "2026-10-19"}
  },
  {
    "id": "109:6", "surah": 109, "ayah": 6, "place": "makkah",
    "title": "Your way is yours, and mine is mine.",
    "subtitle": "A clear boundary, without a fight",
    "picture": {"kind": "boxes", "label": "The boundary", "row": [
      {"box": "people", "title": "your religion", "sub": ["your deeds"]},
      {"box": "idea", "title": "my religion", "sub": ["my deeds"]},
      {"conn": "each"},
      {"box": "plain", "title": "answers for its own", "sub": ["innocent of the other"]}]},
    "key": {"label": "What the line means", "row": [
      {"box": "trap", "title": "hostility", "sub": ["I must fight you"], "strike": true},
      {"box": "idea", "title": "clarity", "sub": ["no mixing, no confusion"]}]},
    "then": "Ibn Kathir links this to: {idea}for me are my deeds and for you are your deeds; you are innocent of what I do, and I am innocent of what you do{/idea}. The surah ends not with a threat but with {reward}a calm, clear line{/reward}.",
    "now": "You do not need to win every argument with the friend who mocks your faith, or prove yourself at every family gathering. {reward}You can simply live your deen, clearly and calmly.{/reward} Your job is your own deeds.",
    "old": "Standing firm in my faith means arguing with everyone who disagrees.",
    "new": "I can hold my deen clearly and calmly. My deeds are mine to answer for.",
    "try": "The next time someone challenges your faith, answer with one calm sentence and then let it go.",
    "related": ["10:41", "28:55"],
    "meta": {"version": 1, "status": "draft", "reviewer": null, "updated": "2026-10-19"}
  }
]
